<?xml version="1.0" encoding="UTF-8"?>
<Protocol version="1.0"  xmlns:xsi="http://www.w3.org/2001/XMLSchema-instance"  xsi:noNamespaceSchemaLocation="schema/dictionaryOnline.xsd">
	
<!-- Diameter Base Protocol RFC3588 -->
	<AVP_Def name="Accounting-Record-Number" code="485" type="Unsigned32" mandatoryFlag="true" />
	<AVP_Def name="Accounting-Record-Type" code="480" type="Enumerated" mandatoryFlag="true">
		<EnumValue value="1" comment="EVENT_RECORD" />
		<EnumValue value="2" comment="START_RECORD" />
		<EnumValue value="3" comment="INTERIM_RECORD" />
		<EnumValue value="4" comment="STOP_RECORD" />
	</AVP_Def>
	<AVP_Def name="Accounting-Realtime-Required" code="483" type="Enumerated" mandatoryFlag="true">
		<EnumValue value="1" comment="DELIVER_AND_GRANT" />
		<EnumValue value="2" comment="GRANT_AND_STORE" />
		<EnumValue value="3" comment="GRANT_AND_LOSE" />
	</AVP_Def>
	<AVP_Def name="Accounting-Session-Id" code="44" type="OctetString" mandatoryFlag="true" />
	<AVP_Def name="Accounting-Sub-Session-Id" code="287" type="Unsigned64" mandatoryFlag="true" />
	<AVP_Def name="Acct-Application-Id" code="259" type="Enumerated" mandatoryFlag="true">
		<EnumValue value="0" comment="Diameter Common Messages" />
		<EnumValue value="1" comment="Diameter NASREQ Application" />
		<EnumValue value="2" comment="Diameter Mobile IPv4 Application" />
		<EnumValue value="3" comment="Diameter Base Accounting" />
		<EnumValue value="16777216" comment="3GPP CX/DX" />
		<EnumValue value="16777217" comment="3GPP Sh" />
		<EnumValue value="16777218" comment="3GPP Re/Rf" />
		<EnumValue value="16777219" comment="3GPP Wx" />
		<EnumValue value="16777220" comment="3GPP Zn" />
		<EnumValue value="16777221" comment="3GPP Zh" />
		<EnumValue value="16777222" comment="3GPP Gq" />
		<EnumValue value="16777223" comment="3GPP Gmb" />
		<EnumValue value="16777302" comment="3GPP Sy" />
		<EnumValue value="16777303" comment="3GPP Sd" />
		<EnumValue value="16777304" comment="Ericsson Sy"/>
	</AVP_Def>
	<AVP_Def name="Acct-Interim-Interval" code="85" type="Unsigned32" mandatoryFlag="true" />
	<AVP_Def name="Acct-Multi-Session-Id" code="50" type="UTF8String" mandatoryFlag="true" />
	<AVP_Def name="Authorization-Lifetime" code="291" type="Unsigned32" mandatoryFlag="true" />
	<AVP_Def name="Auth-Application-Id" code="258" type="Unsigned32" mandatoryFlag="true" />
	<AVP_Def name="Auth-Grace-Period" code="276" type="Unsigned32" mandatoryFlag="true" />
	<AVP_Def name="Auth-Request-Type" code="274" type="Enumerated" mandatoryFlag="true">
		<EnumValue value="1" comment="AUTHENTICATE_ONLY" />
		<EnumValue value="2" comment="AUTHORIZE_ONLY" />
		<EnumValue value="3" comment="AUTHORIZE_AUTHENTICATE" />
	</AVP_Def>
	<AVP_Def name="Auth-Session-State" code="277" type="Enumerated" mandatoryFlag="true">
		<EnumValue value="0" comment="STATE_MAINTAINED" />
		<EnumValue value="1" comment="NO_STATE_MAINTAINED" />
	</AVP_Def>
	<AVP_Def name="Class" code="25" type="OctetString" mandatoryFlag="true" />
	<AVP_Def name="Destination-Host" code="293" type="DiameterIdentity" mandatoryFlag="true" />
	<AVP_Def name="Destination-Realm" code="283" type="DiameterIdentity" mandatoryFlag="true" />
	<AVP_Def name="Disconnect-Cause" code="273" type="Enumerated" mandatoryFlag="true">
		<EnumValue value="0" comment="REBOOTING" />
		<EnumValue value="1" comment="BUSY" />
		<EnumValue value="2" comment="DO_NOT_WANT_TO_TALK_TO_YOU" />
	</AVP_Def>
	<AVP_Def name="E2E-Sequence" code="300" type="Grouped" mandatoryFlag="true" />
	<AVP_Def name="Error-Message" code="281" type="UTF8String" mandatoryFlag="false" />
	<AVP_Def name="Error-Reporting-Host" code="294" type="DiameterIdentity" mandatoryFlag="false" />
	<AVP_Def name="Event-Timestamp" code="55" type="Time" mandatoryFlag="true" />
	<AVP_Def name="Experimental-Result" code="297" type="Grouped" mandatoryFlag="true" />
	<AVP_Def name="Experimental-Result-Code" code="298" type="Unsigned32" mandatoryFlag="true" />
	<AVP_Def name="Failed-AVP" code="279" type="Grouped" mandatoryFlag="true" />
	<AVP_Def name="Firmware-Revision" code="267" type="Unsigned32" mandatoryFlag="false" />
	<AVP_Def name="Host-IP-Address" code="257" type="Address" mandatoryFlag="true" />
	<AVP_Def name="Inband-Security-Id" code="299" type="Unsigned32" mandatoryFlag="false" />
	<AVP_Def name="Multi-Round-Time-Out" code="272" type="Unsigned32" mandatoryFlag="true" />
	<AVP_Def name="Origin-Host" code="264" type="DiameterIdentity" mandatoryFlag="true" />
	<AVP_Def name="Origin-Realm" code="296" type="DiameterIdentity" mandatoryFlag="true" />
	<AVP_Def name="Origin-State-Id" code="278" type="Unsigned32" mandatoryFlag="false" />
	<AVP_Def name="Product-Name" code="269" type="UTF8String" mandatoryFlag="false" />
	<AVP_Def name="Proxy-Host" code="280" type="DiameterIdentity" mandatoryFlag="true" />
	<AVP_Def name="Proxy-Info" code="284" type="Grouped" mandatoryFlag="true" />
	<AVP_Def name="Proxy-State" code="33" type="OctetString" mandatoryFlag="true" />
	<AVP_Def name="Redirect-Host" code="292" type="DiameterURI" mandatoryFlag="true" />
	<AVP_Def name="Redirect-Host-Usage" code="261" type="Enumerated" mandatoryFlag="true">
		<EnumValue value="0" comment="DONT_CACHE" />
		<EnumValue value="1" comment="ALL_SESSION" />
		<EnumValue value="2" comment="ALL_REALM" />
		<EnumValue value="3" comment="REALM_AND_APPLICATION" />
		<EnumValue value="4" comment="ALL_APPLICATION" />
		<EnumValue value="5" comment="ALL_HOST" />
		<EnumValue value="6" comment="ALL_USER" />
	</AVP_Def>
	<AVP_Def name="Redirect-Max-Cache-Time" code="262" type="Unsigned32" mandatoryFlag="true" />
	<AVP_Def name="Result-Code" code="268" type="Enumerated" mandatoryFlag="true">
		<EnumValue value="1001" comment="DIAMETER_MULTI_ROUND_AUTH" />
		<EnumValue value="2001" comment="DIAMETER_SUCCESS" />
		<EnumValue value="2002" comment="DIAMETER_LIMITED_SUCCESS" />
		<EnumValue value="3001" comment="DIAMETER_COMMAND_UNSUPPORTED" />
		<EnumValue value="3002" comment="DIAMETER_UNABLE_TO_DELIVER" />
		<EnumValue value="3003" comment="DIAMETER_REALM_NOT_SERVED" />
		<EnumValue value="3004" comment="DIAMETER_TOO_BUSY" />
		<EnumValue value="3005" comment="DIAMETER_LOOP_DETECTED" />
		<EnumValue value="3006" comment="DIAMETER_REDIRECT_INDICATION" />
		<EnumValue value="3007" comment="DIAMETER_APPLICATION_UNSUPPORTED" />
		<EnumValue value="3008" comment="DIAMETER_INVALID_HDR_BITS" />
		<EnumValue value="3009" comment="DIAMETER_INVALID_AVP_BITS" />
		<EnumValue value="3010" comment="DIAMETER_UNKNOWN_PEER" />
		<EnumValue value="4001" comment="DIAMETER_AUTHENTICATION_REJECTED" />
		<EnumValue value="4002" comment="DIAMETER_OUT_OF_SPACE" />
		<EnumValue value="4003" comment="DIAMETER_ELECTION_LOST" />
		<EnumValue value="4005" comment="DIAMETER_ERROR_MIP_REPLY_FAILURE" />
		<EnumValue value="4006" comment="DIAMETER_ERROR_HA_NOT_AVAILABLE" />
		<EnumValue value="4007" comment="DIAMETER_ERROR_BAD_KEY" />
		<EnumValue value="4008" comment="DIAMETER_ERROR_MIP_FILTER_NOT_SUPPORTED" />
		<EnumValue value="4010" comment="DIAMETER_END_USER_SERVICE_DENIED" />
		<EnumValue value="4011" comment="DIAMETER_CREDIT_CONTROL_NOT_APPLICABLE" />
		<EnumValue value="4012" comment="DIAMETER_CREDIT_LIMIT_REACHED" />
		<EnumValue value="5001" comment="DIAMETER_AVP_UNSUPPORTED" />
		<EnumValue value="5002" comment="DIAMETER_UNKNOWN_SESSION_ID" />
		<EnumValue value="5003" comment="DIAMETER_AUTHORIZATION_REJECTED" />
		<EnumValue value="5004" comment="DIAMETER_INVALID_AVP_VALUE" />
		<EnumValue value="5005" comment="DIAMETER_MISSING_AVP" />
		<EnumValue value="5006" comment="DIAMETER_RESOURCES_EXCEEDED" />
		<EnumValue value="5007" comment="DIAMETER_CONTRADICTING_AVPS" />
		<EnumValue value="5008" comment="DIAMETER_AVP_NOT_ALLOWED" />
		<EnumValue value="5009" comment="DIAMETER_AVP_OCCURS_TOO_MANY_TIMES" />
		<EnumValue value="5010" comment="DIAMETER_NO_COMMON_APPLICATION" />
		<EnumValue value="5011" comment="DIAMETER_UNSUPPORTED_VERSION" />
		<EnumValue value="5012" comment="DIAMETER_UNABLE_TO_COMPLY" />
		<EnumValue value="5013" comment="DIAMETER_INVALID_BIT_IN_HEADER" />
		<EnumValue value="5014" comment="DIAMETER_INVALID_AVP_LENGTH" />
		<EnumValue value="5015" comment="DIAMETER_INVALID_MESSAGE_LENGTH" />
		<EnumValue value="5016" comment="DIAMETER_INVALID_AVP_BIT_COMBO" />
		<EnumValue value="5017" comment="DIAMETER_NO_COMMON_SECURITY" />
		<EnumValue value="5024" comment="DIAMETER_ERROR_NO_FOREIGN_HA_SERVICE" />
		<EnumValue value="5025" comment="DIAMETER_ERROR_END_TO_END_MIP_KEY_ENCRYPTION" />
		<EnumValue value="5030" comment="DIAMETER_USER_UNKNOWN" />
		<EnumValue value="5031" comment="DIAMETER_RATING_FAILED" />
	</AVP_Def>
	<AVP_Def name="Re-Auth-Request-Type" code="285" type="Enumerated" mandatoryFlag="true">
		<EnumValue value="0" comment="AUTHORIZE_ONLY" />
		<EnumValue value="1" comment="AUTHORIZE_AUTHENTICATE" />
	</AVP_Def>
	<AVP_Def name="Route-Record" code="282" type="DiameterIdentity" mandatoryFlag="true" />
	<AVP_Def name="Session-Id" code="263" type="UTF8String" mandatoryFlag="true" />
	<AVP_Def name="Session-Timeout" code="27" type="Unsigned32" mandatoryFlag="true" />
	<AVP_Def name="Session-Binding" code="270" type="Unsigned32" mandatoryFlag="true" />
	<AVP_Def name="Session-Server-Failover" code="271" type="Enumerated" mandatoryFlag="true">
		<EnumValue value="0" comment="REFUSE_SERVICE" />
		<EnumValue value="1" comment="TRY_AGAIN" />
		<EnumValue value="2" comment="ALLOW_SERVICE" />
		<EnumValue value="3" comment="TRY_AGAIN_ALLOW_SERVICE" />
	</AVP_Def>
	<AVP_Def name="Supported-Vendor-Id" code="265" type="Unsigned32" mandatoryFlag="true" />
	<AVP_Def name="Termination-Cause" code="295" type="Enumerated" mandatoryFlag="true">
		<EnumValue value="1" comment="DIAMETER_LOGOUT" />
		<EnumValue value="2" comment="DIAMETER_SERVICE_NOT_PROVIDED" />